{"schema_version":"2.9.0","query":{"lat":45.8,"lon":4.8,"hours":168,"km":3000,"limit":4,"window_start":"2026-10-22T20:34:18Z","window_end":"2026-10-29T20:34:18Z"},"catalog":{"min_level":3,"retention_days":58,"published_at":"2026-10-29T20:24:23.788581Z","last_observation_time":"2026-10-29T19:59:59.983400Z","stale":false,"complete":false},"distance":"path-minus-radius","total":250,"storms":[{"storm":{"storm_id":"91b1973da472d434","slug":"2026-10-24-brescia","name":"Brescia","label":"Brescia, Lombardy, Italy","country_code":"IT","t_start":"2026-10-24T15:44:52.588300Z","t_end":"2026-10-24T16:51:45.839800Z","closed":true,"flashes":134,"peak_rate":8,"level":3,"level_name":"Strong","level_rule":"levels score=flashes_x_peak count=best_source thresholds=8,25,120,450","sources":["mtg-li"],"distance_km":3.2},"distance_km":440,"score":32.741},{"storm":{"storm_id":"91ab55695e0b7c6a","slug":"2026-10-29-bordj-bou-arreridj","name":"Bordj Bou Arreridj","label":"Bordj Bou Arreridj, Bordj Bou Arréridj, Algeria","country_code":"DZ","t_start":"2026-10-29T12:34:50.289000Z","t_end":"2026-10-29T15:21:58.711900Z","closed":true,"flashes":343,"peak_rate":7,"level":3,"level_name":"Strong","level_rule":"levels score=flashes_x_peak count=best_source thresholds=8,25,120,450","sources":["mtg-li"],"distance_km":51.5},"distance_km":1090,"score":49},{"storm":{"storm_id":"1d4179dcdea348ea","slug":"2026-10-24-off-manfredonia","name":"Manfredonia","label":"Adriatic Sea, off Manfredonia, Italy","country_code":null,"t_start":"2026-10-24T12:51:34.838700Z","t_end":"2026-10-24T17:07:18.526300Z","closed":true,"flashes":1669,"peak_rate":47,"level":4,"level_name":"Intense","level_rule":"levels score=flashes_x_peak count=best_source thresholds=8,25,120,450","sources":["mtg-li"],"distance_km":99.2},"distance_km":920,"score":280.077},{"storm":{"storm_id":"a785b9cca761275d","slug":"2026-10-29-ain-el-hadjel","name":"Ain el Hadjel","label":"Ain el Hadjel, M'Sila, Algeria","country_code":"DZ","t_start":"2026-10-29T14:36:05.830700Z","t_end":"2026-10-29T16:37:15.103200Z","closed":true,"flashes":179,"peak_rate":5,"level":3,"level_name":"Strong","level_rule":"levels score=flashes_x_peak count=best_source thresholds=8,25,120,450","sources":["mtg-li"],"distance_km":43.2},"distance_km":1110,"score":29.917}]}